{
  "id": "dance",
  "display_name": "快乐摇摆舞",
  "duration": 3.0,
  "loop": true,
  "easing": "ease_in_out",
  "tracks": {
    "body": {
      "rot": [
        {"t": 0.0, "v": 0.0},
        {"t": 0.75, "v": -6.0},
        {"t": 1.5, "v": 6.0},
        {"t": 2.25, "v": -6.0},
        {"t": 3.0, "v": 0.0}
      ],
      "ty": [
        {"t": 0.0, "v": 0.0},
        {"t": 0.375, "v": -5.0},
        {"t": 0.75, "v": 0.0},
        {"t": 1.125, "v": -5.0},
        {"t": 1.5, "v": 0.0},
        {"t": 1.875, "v": -5.0},
        {"t": 2.25, "v": 0.0},
        {"t": 2.625, "v": -5.0},
        {"t": 3.0, "v": 0.0}
      ]
    },
    "head": {
      "rot": [
        {"t": 0.0, "v": 0.0},
        {"t": 0.75, "v": 10.0},
        {"t": 1.5, "v": -10.0},
        {"t": 2.25, "v": 10.0},
        {"t": 3.0, "v": 0.0}
      ]
    },
    "arm_l": {
      "rot": [
        {"t": 0.0, "v": 0.0},
        {"t": 0.375, "v": 65.0},
        {"t": 0.75, "v": 25.0},
        {"t": 1.125, "v": 65.0},
        {"t": 1.5, "v": 25.0},
        {"t": 1.875, "v": 65.0},
        {"t": 2.25, "v": 25.0},
        {"t": 2.625, "v": 65.0},
        {"t": 3.0, "v": 0.0}
      ]
    },
    "arm_r": {
      "rot": [
        {"t": 0.0, "v": 0.0},
        {"t": 0.375, "v": -25.0},
        {"t": 0.75, "v": -65.0},
        {"t": 1.125, "v": -25.0},
        {"t": 1.5, "v": -65.0},
        {"t": 1.875, "v": -25.0},
        {"t": 2.25, "v": -65.0},
        {"t": 2.625, "v": -25.0},
        {"t": 3.0, "v": 0.0}
      ]
    },
    "leg_l": {
      "rot": [
        {"t": 0.0, "v": 0.0},
        {"t": 0.375, "v": 8.0},
        {"t": 0.75, "v": 0.0},
        {"t": 1.5, "v": 0.0},
        {"t": 2.25, "v": 0.0},
        {"t": 3.0, "v": 0.0}
      ]
    },
    "leg_r": {
      "rot": [
        {"t": 0.0, "v": 0.0},
        {"t": 0.75, "v": 0.0},
        {"t": 1.5, "v": -8.0},
        {"t": 2.25, "v": 0.0},
        {"t": 3.0, "v": 0.0}
      ]
    },
    "eye_l": {
      "sy": [
        {"t": 0.0, "v": 1.0},
        {"t": 0.375, "v": 0.8},
        {"t": 0.75, "v": 1.0},
        {"t": 1.125, "v": 0.8},
        {"t": 1.5, "v": 1.0},
        {"t": 1.875, "v": 0.8},
        {"t": 2.25, "v": 1.0},
        {"t": 2.625, "v": 0.8},
        {"t": 3.0, "v": 1.0}
      ]
    },
    "eye_r": {
      "sy": [
        {"t": 0.0, "v": 1.0},
        {"t": 0.375, "v": 0.8},
        {"t": 0.75, "v": 1.0},
        {"t": 1.125, "v": 0.8},
        {"t": 1.5, "v": 1.0},
        {"t": 1.875, "v": 0.8},
        {"t": 2.25, "v": 1.0},
        {"t": 2.625, "v": 0.8},
        {"t": 3.0, "v": 1.0}
      ]
    },
    "mouth": {
      "sy": [
        {"t": 0.0, "v": 1.0},
        {"t": 0.75, "v": 1.3},
        {"t": 1.5, "v": 1.0},
        {"t": 2.25, "v": 1.3},
        {"t": 3.0, "v": 1.0}
      ]
    }
  }
}