{
  "id": "wave",
  "display_name": "挥手",
  "duration": 1.4,
  "loop": false,
  "easing": "ease_in_out",
  "tracks": {
    "arm_r": {
      "rot": [
        {"t": 0.0, "v": 0.0},
        {"t": 0.35, "v": -115.0},
        {"t": 0.65, "v": -92.0},
        {"t": 0.95, "v": -115.0},
        {"t": 1.4, "v": 0.0}
      ]
    },
    "head": {
      "rot": [
        {"t": 0.0, "v": 0.0},
        {"t": 0.35, "v": -3.0},
        {"t": 0.95, "v": 3.0},
        {"t": 1.4, "v": 0.0}
      ]
    }
  }
}