{
  "id": "yawn",
  "display_name": "打哈欠",
  "duration": 2.0,
  "loop": false,
  "easing": "ease_in_out",
  "tracks": {
    "mouth": {
      "sx": [
        {"t": 0.0, "v": 1.0},
        {"t": 0.7, "v": 0.94},
        {"t": 1.2, "v": 0.86},
        {"t": 1.5, "v": 0.86},
        {"t": 1.95, "v": 1.0},
        {"t": 2.0, "v": 1.0}
      ],
      "sy": [
        {"t": 0.0, "v": 1.0},
        {"t": 0.7, "v": 1.45},
        {"t": 1.2, "v": 2.15},
        {"t": 1.5, "v": 2.15},
        {"t": 1.95, "v": 1.0},
        {"t": 2.0, "v": 1.0}
      ],
      "ty": [
        {"t": 0.0, "v": 0.0},
        {"t": 0.7, "v": -3.0},
        {"t": 1.2, "v": -8.0},
        {"t": 1.5, "v": -8.0},
        {"t": 1.95, "v": 0.0},
        {"t": 2.0, "v": 0.0}
      ]
    },
    "eye_l": {
      "sy": [
        {"t": 0.0, "v": 1.0},
        {"t": 0.65, "v": 0.55},
        {"t": 1.2, "v": 0.2},
        {"t": 1.5, "v": 0.2},
        {"t": 1.95, "v": 1.0},
        {"t": 2.0, "v": 1.0}
      ]
    },
    "eye_r": {
      "sy": [
        {"t": 0.0, "v": 1.0},
        {"t": 0.65, "v": 0.55},
        {"t": 1.2, "v": 0.2},
        {"t": 1.5, "v": 0.2},
        {"t": 1.95, "v": 1.0},
        {"t": 2.0, "v": 1.0}
      ]
    },
    "arm_l": {
      "rot": [
        {"t": 0.0, "v": 0.0},
        {"t": 0.7, "v": 12.0},
        {"t": 1.2, "v": 20.0},
        {"t": 1.5, "v": 20.0},
        {"t": 1.95, "v": 0.0},
        {"t": 2.0, "v": 0.0}
      ]
    },
    "arm_r": {
      "rot": [
        {"t": 0.0, "v": 0.0},
        {"t": 0.7, "v": -70.0},
        {"t": 1.2, "v": -100.0},
        {"t": 1.5, "v": -100.0},
        {"t": 1.95, "v": 0.0},
        {"t": 2.0, "v": 0.0}
      ]
    },
    "head": {
      "rot": [
        {"t": 0.0, "v": 0.0},
        {"t": 0.7, "v": 3.0},
        {"t": 1.2, "v": 4.0},
        {"t": 1.5, "v": 4.0},
        {"t": 1.95, "v": 0.0},
        {"t": 2.0, "v": 0.0}
      ]
    }
  }
}