{
  "id": "shake_head",
  "display_name": "摇头",
  "duration": 1.1,
  "loop": false,
  "easing": "ease_in_out",
  "tracks": {
    "head": {
      "rot": [
        {"t": 0.0, "v": 0.0},
        {"t": 0.18, "v": -7.0},
        {"t": 0.42, "v": 7.0},
        {"t": 0.66, "v": -7.0},
        {"t": 0.88, "v": 4.0},
        {"t": 1.1, "v": 0.0}
      ]
    }
  }
}