{
  "id": "nod",
  "display_name": "点头",
  "duration": 0.9,
  "loop": false,
  "easing": "ease_in_out",
  "tracks": {
    "head": {
      "ty": [
        {"t": 0.0, "v": 0.0},
        {"t": 0.18, "v": 8.0},
        {"t": 0.38, "v": 0.0},
        {"t": 0.58, "v": 8.0},
        {"t": 0.9, "v": 0.0}
      ]
    }
  }
}