{
  "id": "idle_breath",
  "display_name": "呼吸待机",
  "duration": 3.7,
  "loop": true,
  "easing": "ease_in_out",
  "tracks": {
    "body": {
      "sx": [
        {"t": 0.0, "v": 1.0},
        {"t": 1.85, "v": 1.02},
        {"t": 3.7, "v": 1.0}
      ],
      "sy": [
        {"t": 0.0, "v": 1.0},
        {"t": 1.85, "v": 1.015},
        {"t": 3.7, "v": 1.0}
      ],
      "ty": [
        {"t": 0.0, "v": 0.0},
        {"t": 1.85, "v": -1.5},
        {"t": 3.7, "v": 0.0}
      ]
    },
    "head": {
      "ty": [
        {"t": 0.0, "v": 0.0},
        {"t": 1.85, "v": 0.5},
        {"t": 3.7, "v": 0.0}
      ]
    },
    "arm_l": {
      "rot": [
        {"t": 0.0, "v": 0.0},
        {"t": 1.85, "v": 1.5},
        {"t": 3.7, "v": 0.0}
      ]
    },
    "arm_r": {
      "rot": [
        {"t": 0.0, "v": 0.0},
        {"t": 1.85, "v": -1.5},
        {"t": 3.7, "v": 0.0}
      ]
    }
  }
}