{
  "id": "walk",
  "display_name": "行走",
  "duration": 0.8,
  "loop": true,
  "easing": "ease_in_out",
  "tracks": {
    "arm_l": {
      "rot": [
        {"t": 0.0, "v": 0.0},
        {"t": 0.2, "v": 16.0},
        {"t": 0.4, "v": 0.0},
        {"t": 0.6, "v": -16.0},
        {"t": 0.8, "v": 0.0}
      ]
    },
    "arm_r": {
      "rot": [
        {"t": 0.0, "v": 0.0},
        {"t": 0.2, "v": -16.0},
        {"t": 0.4, "v": 0.0},
        {"t": 0.6, "v": 16.0},
        {"t": 0.8, "v": 0.0}
      ]
    },
    "leg_l": {
      "rot": [
        {"t": 0.0, "v": 0.0},
        {"t": 0.2, "v": -10.0},
        {"t": 0.4, "v": 0.0},
        {"t": 0.6, "v": 10.0},
        {"t": 0.8, "v": 0.0}
      ]
    },
    "leg_r": {
      "rot": [
        {"t": 0.0, "v": 0.0},
        {"t": 0.2, "v": 10.0},
        {"t": 0.4, "v": 0.0},
        {"t": 0.6, "v": -10.0},
        {"t": 0.8, "v": 0.0}
      ]
    },
    "body": {
      "ty": [
        {"t": 0.0, "v": 0.0},
        {"t": 0.2, "v": -1.5},
        {"t": 0.4, "v": 0.0},
        {"t": 0.6, "v": -1.5},
        {"t": 0.8, "v": 0.0}
      ]
    }
  }
}