{
  "id": "jump",
  "display_name": "跳跃",
  "duration": 0.9,
  "loop": false,
  "easing": "ease_out",
  "tracks": {
    "root": {
      "ty": [
        {"t": 0.0, "v": 0.0, "ease": "ease_out"},
        {"t": 0.22, "v": -42.0, "ease": "ease_in"},
        {"t": 0.48, "v": 0.0, "ease": "ease_out"},
        {"t": 0.62, "v": -12.0, "ease": "ease_in"},
        {"t": 0.9, "v": 0.0}
      ]
    },
    "arm_l": {
      "rot": [
        {"t": 0.0, "v": 0.0},
        {"t": 0.22, "v": 18.0},
        {"t": 0.48, "v": 0.0},
        {"t": 0.9, "v": 0.0}
      ]
    },
    "arm_r": {
      "rot": [
        {"t": 0.0, "v": 0.0},
        {"t": 0.22, "v": -18.0},
        {"t": 0.48, "v": 0.0},
        {"t": 0.9, "v": 0.0}
      ]
    },
    "leg_l": {
      "rot": [
        {"t": 0.0, "v": 0.0},
        {"t": 0.22, "v": -6.0},
        {"t": 0.48, "v": 0.0},
        {"t": 0.9, "v": 0.0}
      ]
    },
    "leg_r": {
      "rot": [
        {"t": 0.0, "v": 0.0},
        {"t": 0.22, "v": 6.0},
        {"t": 0.48, "v": 0.0},
        {"t": 0.9, "v": 0.0}
      ]
    }
  }
}