{
  "id": "blink",
  "display_name": "眨眼",
  "duration": 1.08,
  "loop": false,
  "easing": "ease_in_out",
  "tracks": {
    "eye_l": {
      "sy": [
        {"t": 0.0, "v": 1.0},
        {"t": 0.10, "v": 0.1},
        {"t": 0.25, "v": 0.1},
        {"t": 0.36, "v": 1.0},
        {"t": 0.37, "v": 1.0},
        {"t": 0.46, "v": 0.1},
        {"t": 0.61, "v": 0.1},
        {"t": 0.72, "v": 1.0},
        {"t": 0.73, "v": 1.0},
        {"t": 0.82, "v": 0.1},
        {"t": 0.97, "v": 0.1},
        {"t": 1.08, "v": 1.0}
      ]
    },
    "eye_r": {
      "sy": [
        {"t": 0.0, "v": 1.0},
        {"t": 0.10, "v": 0.1},
        {"t": 0.25, "v": 0.1},
        {"t": 0.36, "v": 1.0},
        {"t": 0.37, "v": 1.0},
        {"t": 0.46, "v": 0.1},
        {"t": 0.61, "v": 0.1},
        {"t": 0.72, "v": 1.0},
        {"t": 0.73, "v": 1.0},
        {"t": 0.82, "v": 0.1},
        {"t": 0.97, "v": 0.1},
        {"t": 1.08, "v": 1.0}
      ]
    }
  }
}